{"$schema":"https://json-schema.org/draft/2020-12/schema","$id":"https://restic-central.invalid/schemas/v1/job.cancel.schema.json","title":"restic-central job.cancel v1","type":"object","additionalProperties":false,"required":["schema_version","message_type","message_id","sent_at","payload"],"properties":{"schema_version":{"type":"integer","const":1},"message_type":{"const":"job.cancel"},"message_id":{"$ref":"_shared.schema.json#/$defs/uuid"},"correlation_id":{"$ref":"_shared.schema.json#/$defs/uuid"},"agent_id":{"$ref":"_shared.schema.json#/$defs/uuid"},"sent_at":{"$ref":"_shared.schema.json#/$defs/date_time"},"payload":{"$ref":"_shared.schema.json#/$defs/message_payload"},"extensions":{"$ref":"_shared.schema.json#/$defs/extensions"}}}